{
  "screenId": "backup.overlay",
  "route": "/backup",
  "state": "import preview",
  "verdict": "warn",
  "confidence": 0,
  "issues": [
    {
      "code": "AI_REVIEW_SKIPPED",
      "severity": "low",
      "message": "OPENAI_API_KEY is not set; AI review skipped.",
      "evidence": "",
      "location": "",
      "suggestedFix": ""
    }
  ],
  "summary": "OPENAI_API_KEY is not set; AI review skipped.",
  "artifacts": {
    "artifactDir": "test-results/ai-artifacts",
    "screenshot": "test-results\\ai-artifacts\\backup.overlay.2026-03-06T16-46-21-761Z.png",
    "testIds": "test-results\\ai-artifacts\\backup.overlay.2026-03-06T16-46-21-761Z.dom-testids.json",
    "visibleText": "test-results\\ai-artifacts\\backup.overlay.2026-03-06T16-46-21-761Z.visible-text.txt",
    "ariaSnapshot": "test-results\\ai-artifacts\\backup.overlay.2026-03-06T16-46-21-761Z.aria-snapshot.json",
    "meta": "test-results\\ai-artifacts\\backup.overlay.2026-03-06T16-46-21-761Z.meta.json"
  },
  "createdAt": "2026-03-06T16:47:11.383Z",
  "model": "fallback"
}
