{
  "screenId": "schedule.toast.during-dictation",
  "route": "/engines/dictation",
  "state": "dictation running with schedule reminder",
  "verdict": "warn",
  "confidence": 0,
  "issues": [
    {
      "code": "AI_REVIEW_SKIPPED",
      "severity": "low",
      "message": "OPENAI_API_KEY is not set; AI review skipped.",
      "evidence": "",
      "location": "",
      "suggestedFix": ""
    }
  ],
  "summary": "OPENAI_API_KEY is not set; AI review skipped.",
  "artifacts": {
    "artifactDir": "test-results/ai-artifacts",
    "screenshot": "test-results\\ai-artifacts\\schedule.toast.during-dictation.2026-03-07T01-51-37-403Z.png",
    "testIds": "test-results\\ai-artifacts\\schedule.toast.during-dictation.2026-03-07T01-51-37-403Z.dom-testids.json",
    "visibleText": "test-results\\ai-artifacts\\schedule.toast.during-dictation.2026-03-07T01-51-37-403Z.visible-text.txt",
    "ariaSnapshot": "test-results\\ai-artifacts\\schedule.toast.during-dictation.2026-03-07T01-51-37-403Z.aria-snapshot.json",
    "meta": "test-results\\ai-artifacts\\schedule.toast.during-dictation.2026-03-07T01-51-37-403Z.meta.json"
  },
  "createdAt": "2026-03-07T01:52:43.490Z",
  "model": "fallback"
}
